{"contract":"learnit.kit.v2","packageLineageId":"e13a8dfd-5c7e-4f99-abd9-73ad334039a1","packageRevisionId":"ad0064db-2150-470f-b8a9-8e4a475a0f8f","packageRevisionDigest":"sha256:13f55500bd91227317b9477177d1b2e0d622d6806356fcb8fe002cdf9a0414c8","title":"Signaux électriques — kit représentatif v2","description":"Kit de fondation représentatif : lecture et calcul de caractéristiques de signaux sinusoïdaux, avec distinction amplitude, crête-à-crête et valeur efficace. Il ne constitue pas un cursus complet.","versionLabel":"foundation-v1","language":"fr-FR","courses":[{"courseLineageId":"24a8a10a-c8e0-432c-8120-8f825daf6e5f","courseRevisionId":"8ff39c5f-d1cd-49a3-b367-3278b8d8abcf","courseRevisionDigest":"sha256:ba9f13ec4e7c5ed1f8ce6c1eaa4884cba2d04265f3c7deb96c28fddc7922fee1","title":"Signaux électriques — caractérisation","subtitle":"Tension, courant, amplitude, période, fréquence, pulsation et valeur efficace.","estimatedMinutes":35,"objectives":[{"objectiveId":"e6a159cb-cd4d-4565-9d61-eda32db9002e","label":"Caractériser un signal sinusoïdal par son amplitude, sa période, sa fréquence, sa pulsation et sa valeur efficace."},{"objectiveId":"324ec962-5ca9-4ed2-8737-654020805939","label":"Appliquer des relations physiques et des unités cohérentes à des tensions et courants sinusoïdaux."}],"activities":[{"activityLineageId":"d6b20d87-180b-443a-bcd0-5b3402bb1480","activityRevisionId":"33097c93-aef6-48c5-a73b-23b1822fc954","activityRevisionDigest":"sha256:08e8a2c9051b15e1db22e2af568419787c7640294f2cd6ee8e733a5d1a0b22a1","objectiveIds":["e6a159cb-cd4d-4565-9d61-eda32db9002e"],"type":"qcm","prompt":"Quelle relation relie la fréquence f et la période T d’un signal périodique ?","explanation":"La période T est la durée d’un motif, en secondes, et la fréquence f est le nombre de motifs par seconde, en hertz. Elles sont réciproques : f=1/T.","difficulty":"easy","learningPhase":"activation","assessmentRole":"practice","choices":[{"choiceId":"c8f35abe-094b-4fe6-9e74-7e4ab1877303","label":"f=T"},{"choiceId":"03b0bb49-8698-462f-abc0-b1198257e4b8","label":"f=2πT"},{"choiceId":"be4adc21-1010-48f8-a836-2cf3883bece7","label":"f=1/T"},{"choiceId":"9bf5811d-47f2-4c9d-b624-32c3290a0386","label":"f=T²"}],"correctChoiceId":"be4adc21-1010-48f8-a836-2cf3883bece7"},{"activityLineageId":"e4abce22-0784-4bc1-b7ea-f103b36ce013","activityRevisionId":"c9fe5ee5-f772-4565-a43a-cc371a68c38e","activityRevisionDigest":"sha256:ca7d6daf66c06f2d1240ce035efb2e59b117864180fe3ccbbd779a825dd492cd","objectiveIds":["e6a159cb-cd4d-4565-9d61-eda32db9002e"],"type":"qcm","prompt":"Pour u(t)=2 + 3 cos(100πt), quelle est l’amplitude de la tension ?","explanation":"Dans u(t)=U₀+U cos(ωt+φ), U₀ est la valeur moyenne et U l’amplitude. Ici l’offset vaut 2 V et l’amplitude vaut 3 V ; la valeur maximale est 5 V et la crête-à-crête vaut 6 V.","difficulty":"medium","learningPhase":"comprehension","assessmentRole":"practice","choices":[{"choiceId":"7ba5b671-c6c0-4386-aaf6-61c241baf742","label":"2 V"},{"choiceId":"4bab7527-362f-4d28-aabc-c034ff4fda10","label":"3 V"},{"choiceId":"3f3e7ddc-e0c3-4c94-979f-8f8c1c81bb4a","label":"5 V"},{"choiceId":"17fc3b49-e0ae-4cb6-8d0a-7ac2132c3a09","label":"6 V"}],"correctChoiceId":"4bab7527-362f-4d28-aabc-c034ff4fda10"},{"activityLineageId":"96d27107-4c6a-4f9b-be7c-fa61db2222b9","activityRevisionId":"e7ca9eed-ff4e-4449-a274-9db343cc57ef","activityRevisionDigest":"sha256:9d506a7c9f42cb5f5613225f109029ade398f3ba857a698505e2429803c851b9","objectiveIds":["e6a159cb-cd4d-4565-9d61-eda32db9002e"],"type":"fill","prompt":"Un signal sinusoïdal a une période T = 20 ms. Compléter sa fréquence et sa pulsation.","explanation":"20 ms = 0,020 s, donc f=1/T=50 Hz. La pulsation vaut ω=2πf=100π rad·s⁻¹.","difficulty":"medium","learningPhase":"application","assessmentRole":"practice","segments":[{"text":"La fréquence vaut "},{"slotId":"76ca9070-6587-434b-9f7a-753cedfe6d8e"},{"text":" et la pulsation vaut "},{"slotId":"eeb2024c-e2b0-4b75-a67e-2d2027e6cde1"},{"text":"."}],"tokens":[{"tokenId":"4034f654-52e1-4846-bdfb-80bdeec2deba","label":"50 Hz","maxUses":1},{"tokenId":"8e7b6fc0-709b-42f4-81a3-e2afe500ec41","label":"20 Hz","maxUses":1},{"tokenId":"4102e27b-883c-4e41-a7a6-575b9d8aae1f","label":"100π rad·s⁻¹","maxUses":1},{"tokenId":"c08b5f88-ff24-4980-97ea-4bf5be4ef1de","label":"50π rad·s⁻¹","maxUses":1}],"answers":[{"slotId":"76ca9070-6587-434b-9f7a-753cedfe6d8e","tokenId":"4034f654-52e1-4846-bdfb-80bdeec2deba"},{"slotId":"eeb2024c-e2b0-4b75-a67e-2d2027e6cde1","tokenId":"4102e27b-883c-4e41-a7a6-575b9d8aae1f"}]},{"activityLineageId":"d98bdb57-9671-40a4-86a9-1c5ff8c27139","activityRevisionId":"934644d3-779c-4d3e-b452-806668e2496d","activityRevisionDigest":"sha256:161a9f5ddedb3e8c6b5e2e668b734f075d8922943a393195bc1407790451c91d","objectiveIds":["e6a159cb-cd4d-4565-9d61-eda32db9002e"],"type":"fill","prompt":"Transfert : pour u(t)=4 cos(2π·50t) V, distinguer la tension crête-à-crête et la valeur efficace.","explanation":"L’amplitude est U=4 V. La crête-à-crête vaut 2U=8 V. Pour une sinusoïde sans offset, Ueff=U/√2≈2,83 V ; elle ne vaut ni l’amplitude ni la moitié de la crête-à-crête.","difficulty":"advanced","learningPhase":"transfer","assessmentRole":"practice","segments":[{"text":"La valeur crête-à-crête est "},{"slotId":"388908a9-bc9a-4cbd-8e2b-e9c1765bad9c"},{"text":" et la valeur efficace est environ "},{"slotId":"c1569d07-3710-4c62-bdaf-383243e2a9ed"},{"text":"."}],"tokens":[{"tokenId":"ce820e4e-dfa7-410c-bb7f-a08913251158","label":"8 V","maxUses":1},{"tokenId":"a8d3dcb6-76c9-4588-abb3-63644863444b","label":"4 V","maxUses":1},{"tokenId":"a6a283bf-297e-42b6-9a0d-10e4b981a43d","label":"2,83 V","maxUses":1},{"tokenId":"1c0684c1-b16e-4211-ab17-c4a05000a263","label":"5,66 V","maxUses":1}],"answers":[{"slotId":"388908a9-bc9a-4cbd-8e2b-e9c1765bad9c","tokenId":"ce820e4e-dfa7-410c-bb7f-a08913251158"},{"slotId":"c1569d07-3710-4c62-bdaf-383243e2a9ed","tokenId":"a6a283bf-297e-42b6-9a0d-10e4b981a43d"}]},{"activityLineageId":"052790cb-2c80-40ba-ab7b-ce37e1d52d33","activityRevisionId":"4fa16e94-1998-4428-a663-82ad257a3b56","activityRevisionDigest":"sha256:8b81fd28da8449e1c6023d3b22c2922b9a4bcd9f9c7b49dbb5058db5b530fe6d","objectiveIds":["324ec962-5ca9-4ed2-8737-654020805939"],"type":"qcm","prompt":"Une résistance de 200 Ω est soumise à une tension sinusoïdale de valeur efficace 10 V. Quelle est la valeur efficace du courant ?","explanation":"Pour un résistor, la loi d’Ohm s’applique aussi aux valeurs efficaces en régime sinusoïdal : Ieff=Ueff/R=10/200=0,05 A=50 mA.","difficulty":"medium","learningPhase":"application","assessmentRole":"practice","choices":[{"choiceId":"5e1c840e-3050-41f1-8dab-e33ab1b56713","label":"20 mA"},{"choiceId":"1733e105-5a04-4c78-80e6-6a3c60d60307","label":"50 mA"},{"choiceId":"539b2c80-c97c-4af4-ab7f-90fbdab2aa66","label":"2 A"},{"choiceId":"64368ab9-0275-40dc-abf9-280e7e0d5733","label":"2000 mA"}],"correctChoiceId":"1733e105-5a04-4c78-80e6-6a3c60d60307"},{"activityLineageId":"abde2a95-d3aa-4422-8f4c-deb43fe24f2f","activityRevisionId":"6127f6cf-5db7-4960-89b4-bb1d0d0d062f","activityRevisionDigest":"sha256:da0184d3e50890483575c75aae2e94d1aa7e120661bafbe6cee928a1de64efaa","objectiveIds":["e6a159cb-cd4d-4565-9d61-eda32db9002e","324ec962-5ca9-4ed2-8737-654020805939"],"type":"fill","prompt":"Validation : caractériser i(t)=0,2 cos(400πt) A.","explanation":"L’amplitude est 0,2 A. Comme ω=400π rad·s⁻¹, f=ω/(2π)=200 Hz et T=1/f=5 ms. La valeur crête-à-crête vaut deux fois l’amplitude, soit 0,4 A.","difficulty":"advanced","learningPhase":"validation","assessmentRole":"validation","segments":[{"text":"L’amplitude est "},{"slotId":"d89a677a-f774-47e4-b79f-2868b564a510"},{"text":", la période est "},{"slotId":"aba7012d-b4b6-48fc-8c6d-eb9774387d9a"},{"text":" et la valeur crête-à-crête est "},{"slotId":"1aa61fad-00d5-4ca1-8e5a-3bcf4451f925"},{"text":"."}],"tokens":[{"tokenId":"00531d6b-1902-43a9-9f2a-00892a61c94e","label":"0,2 A","maxUses":1},{"tokenId":"93dfc298-1c39-49b3-ac60-9352aa9eca5d","label":"0,4 A","maxUses":1},{"tokenId":"67765ed1-c939-4c99-ba07-c3a8848a3bd6","label":"5 ms","maxUses":1},{"tokenId":"4e982776-56ce-4837-8056-c8a002503c04","label":"2,5 ms","maxUses":1},{"tokenId":"b5c53027-02f5-42bf-8260-5ea0d714bd5f","label":"200 ms","maxUses":1}],"answers":[{"slotId":"d89a677a-f774-47e4-b79f-2868b564a510","tokenId":"00531d6b-1902-43a9-9f2a-00892a61c94e"},{"slotId":"aba7012d-b4b6-48fc-8c6d-eb9774387d9a","tokenId":"67765ed1-c939-4c99-ba07-c3a8848a3bd6"},{"slotId":"1aa61fad-00d5-4ca1-8e5a-3bcf4451f925","tokenId":"93dfc298-1c39-49b3-ac60-9352aa9eca5d"}]}]}]}